{
  "advice": [
    {
      "code": "GRAPH_RELATED_ID_ASYMMETRY",
      "message": "'MEMINIT-ADR-014' lists 'MEMINIT-PRD-006' in related_ids but 'MEMINIT-PRD-006' does not list 'MEMINIT-ADR-014'",
      "source": "MEMINIT-ADR-014",
      "target": "MEMINIT-PRD-006"
    },
    {
      "code": "GRAPH_RELATED_ID_ASYMMETRY",
      "message": "'MEMINIT-ADR-014' lists 'MEMINIT-SPEC-007' in related_ids but 'MEMINIT-SPEC-007' does not list 'MEMINIT-ADR-014'",
      "source": "MEMINIT-ADR-014",
      "target": "MEMINIT-SPEC-007"
    },
    {
      "code": "GRAPH_RELATED_ID_ASYMMETRY",
      "message": "'MEMINIT-FDD-010' lists 'MEMINIT-ADR-014' in related_ids but 'MEMINIT-ADR-014' does not list 'MEMINIT-FDD-010'",
      "source": "MEMINIT-FDD-010",
      "target": "MEMINIT-ADR-014"
    },
    {
      "code": "GRAPH_RELATED_ID_ASYMMETRY",
      "message": "'MEMINIT-FDD-010' lists 'MEMINIT-PRD-006' in related_ids but 'MEMINIT-PRD-006' does not list 'MEMINIT-FDD-010'",
      "source": "MEMINIT-FDD-010",
      "target": "MEMINIT-PRD-006"
    },
    {
      "code": "GRAPH_RELATED_ID_ASYMMETRY",
      "message": "'MEMINIT-FDD-010' lists 'MEMINIT-SPEC-007' in related_ids but 'MEMINIT-SPEC-007' does not list 'MEMINIT-FDD-010'",
      "source": "MEMINIT-FDD-010",
      "target": "MEMINIT-SPEC-007"
    },
    {
      "code": "GRAPH_RELATED_ID_ASYMMETRY",
      "message": "'MEMINIT-FDD-011' lists 'MEMINIT-FDD-004' in related_ids but 'MEMINIT-FDD-004' does not list 'MEMINIT-FDD-011'",
      "source": "MEMINIT-FDD-011",
      "target": "MEMINIT-FDD-004"
    },
    {
      "code": "GRAPH_RELATED_ID_ASYMMETRY",
      "message": "'MEMINIT-FDD-011' lists 'MEMINIT-PRD-006' in related_ids but 'MEMINIT-PRD-006' does not list 'MEMINIT-FDD-011'",
      "source": "MEMINIT-FDD-011",
      "target": "MEMINIT-PRD-006"
    },
    {
      "code": "GRAPH_RELATED_ID_ASYMMETRY",
      "message": "'MEMINIT-FDD-011' lists 'MEMINIT-SPEC-007' in related_ids but 'MEMINIT-SPEC-007' does not list 'MEMINIT-FDD-011'",
      "source": "MEMINIT-FDD-011",
      "target": "MEMINIT-SPEC-007"
    },
    {
      "code": "GRAPH_RELATED_ID_ASYMMETRY",
      "message": "'MEMINIT-FDD-012' lists 'MEMINIT-PRD-005' in related_ids but 'MEMINIT-PRD-005' does not list 'MEMINIT-FDD-012'",
      "source": "MEMINIT-FDD-012",
      "target": "MEMINIT-PRD-005"
    },
    {
      "code": "GRAPH_RELATED_ID_ASYMMETRY",
      "message": "'MEMINIT-FDD-012' lists 'MEMINIT-SPEC-006' in related_ids but 'MEMINIT-SPEC-006' does not list 'MEMINIT-FDD-012'",
      "source": "MEMINIT-FDD-012",
      "target": "MEMINIT-SPEC-006"
    },
    {
      "code": "GRAPH_RELATED_ID_ASYMMETRY",
      "message": "'MEMINIT-FDD-013' lists 'MEMINIT-PLAN-013' in related_ids but 'MEMINIT-PLAN-013' does not list 'MEMINIT-FDD-013'",
      "source": "MEMINIT-FDD-013",
      "target": "MEMINIT-PLAN-013"
    },
    {
      "code": "GRAPH_RELATED_ID_ASYMMETRY",
      "message": "'MEMINIT-FDD-013' lists 'MEMINIT-PRD-005' in related_ids but 'MEMINIT-PRD-005' does not list 'MEMINIT-FDD-013'",
      "source": "MEMINIT-FDD-013",
      "target": "MEMINIT-PRD-005"
    },
    {
      "code": "GRAPH_RELATED_ID_ASYMMETRY",
      "message": "'MEMINIT-FDD-013' lists 'MEMINIT-PRD-007' in related_ids but 'MEMINIT-PRD-007' does not list 'MEMINIT-FDD-013'",
      "source": "MEMINIT-FDD-013",
      "target": "MEMINIT-PRD-007"
    },
    {
      "code": "GRAPH_RELATED_ID_ASYMMETRY",
      "message": "'MEMINIT-FDD-013' lists 'MEMINIT-SPEC-006' in related_ids but 'MEMINIT-SPEC-006' does not list 'MEMINIT-FDD-013'",
      "source": "MEMINIT-FDD-013",
      "target": "MEMINIT-SPEC-006"
    },
    {
      "code": "GRAPH_RELATED_ID_ASYMMETRY",
      "message": "'MEMINIT-FDD-013' lists 'MEMINIT-SPEC-008' in related_ids but 'MEMINIT-SPEC-008' does not list 'MEMINIT-FDD-013'",
      "source": "MEMINIT-FDD-013",
      "target": "MEMINIT-SPEC-008"
    },
    {
      "code": "GRAPH_RELATED_ID_ASYMMETRY",
      "message": "'MEMINIT-FDD-014' lists 'MEMINIT-PLAN-014' in related_ids but 'MEMINIT-PLAN-014' does not list 'MEMINIT-FDD-014'",
      "source": "MEMINIT-FDD-014",
      "target": "MEMINIT-PLAN-014"
    },
    {
      "code": "GRAPH_RELATED_ID_ASYMMETRY",
      "message": "'MEMINIT-FDD-014' lists 'MEMINIT-SPEC-006' in related_ids but 'MEMINIT-SPEC-006' does not list 'MEMINIT-FDD-014'",
      "source": "MEMINIT-FDD-014",
      "target": "MEMINIT-SPEC-006"
    },
    {
      "code": "GRAPH_RELATED_ID_ASYMMETRY",
      "message": "'MEMINIT-FDD-014' lists 'MEMINIT-SPEC-011' in related_ids but 'MEMINIT-SPEC-011' does not list 'MEMINIT-FDD-014'",
      "source": "MEMINIT-FDD-014",
      "target": "MEMINIT-SPEC-011"
    },
    {
      "code": "GRAPH_RELATED_ID_ASYMMETRY",
      "message": "'MEMINIT-IMPL-001' lists 'MEMINIT-PLAN-010' in related_ids but 'MEMINIT-PLAN-010' does not list 'MEMINIT-IMPL-001'",
      "source": "MEMINIT-IMPL-001",
      "target": "MEMINIT-PLAN-010"
    },
    {
      "code": "GRAPH_RELATED_ID_ASYMMETRY",
      "message": "'MEMINIT-IMPL-001' lists 'MEMINIT-PRD-005' in related_ids but 'MEMINIT-PRD-005' does not list 'MEMINIT-IMPL-001'",
      "source": "MEMINIT-IMPL-001",
      "target": "MEMINIT-PRD-005"
    },
    {
      "code": "GRAPH_RELATED_ID_ASYMMETRY",
      "message": "'MEMINIT-LOG-001' lists 'MEMINIT-PLAN-014' in related_ids but 'MEMINIT-PLAN-014' does not list 'MEMINIT-LOG-001'",
      "source": "MEMINIT-LOG-001",
      "target": "MEMINIT-PLAN-014"
    },
    {
      "code": "GRAPH_RELATED_ID_ASYMMETRY",
      "message": "'MEMINIT-LOG-001' lists 'MEMINIT-PLAN-015' in related_ids but 'MEMINIT-PLAN-015' does not list 'MEMINIT-LOG-001'",
      "source": "MEMINIT-LOG-001",
      "target": "MEMINIT-PLAN-015"
    },
    {
      "code": "GRAPH_RELATED_ID_ASYMMETRY",
      "message": "'MEMINIT-LOG-001' lists 'MEMINIT-RUNBOOK-006' in related_ids but 'MEMINIT-RUNBOOK-006' does not list 'MEMINIT-LOG-001'",
      "source": "MEMINIT-LOG-001",
      "target": "MEMINIT-RUNBOOK-006"
    },
    {
      "code": "GRAPH_RELATED_ID_ASYMMETRY",
      "message": "'MEMINIT-LOG-005' lists 'MEMINIT-PLAN-016' in related_ids but 'MEMINIT-PLAN-016' does not list 'MEMINIT-LOG-005'",
      "source": "MEMINIT-LOG-005",
      "target": "MEMINIT-PLAN-016"
    },
    {
      "code": "GRAPH_RELATED_ID_ASYMMETRY",
      "message": "'MEMINIT-PLAN-004' lists 'MEMINIT-PLAN-003' in related_ids but 'MEMINIT-PLAN-003' does not list 'MEMINIT-PLAN-004'",
      "source": "MEMINIT-PLAN-004",
      "target": "MEMINIT-PLAN-003"
    },
    {
      "code": "GRAPH_RELATED_ID_ASYMMETRY",
      "message": "'MEMINIT-PLAN-004' lists 'MEMINIT-PRD-003' in related_ids but 'MEMINIT-PRD-003' does not list 'MEMINIT-PLAN-004'",
      "source": "MEMINIT-PLAN-004",
      "target": "MEMINIT-PRD-003"
    },
    {
      "code": "GRAPH_RELATED_ID_ASYMMETRY",
      "message": "'MEMINIT-PLAN-004' lists 'MEMINIT-SPEC-003' in related_ids but 'MEMINIT-SPEC-003' does not list 'MEMINIT-PLAN-004'",
      "source": "MEMINIT-PLAN-004",
      "target": "MEMINIT-SPEC-003"
    },
    {
      "code": "GRAPH_RELATED_ID_ASYMMETRY",
      "message": "'MEMINIT-PLAN-004' lists 'MEMINIT-SPEC-004' in related_ids but 'MEMINIT-SPEC-004' does not list 'MEMINIT-PLAN-004'",
      "source": "MEMINIT-PLAN-004",
      "target": "MEMINIT-SPEC-004"
    },
    {
      "code": "GRAPH_RELATED_ID_ASYMMETRY",
      "message": "'MEMINIT-PLAN-006' lists 'MEMINIT-PLAN-005' in related_ids but 'MEMINIT-PLAN-005' does not list 'MEMINIT-PLAN-006'",
      "source": "MEMINIT-PLAN-006",
      "target": "MEMINIT-PLAN-005"
    },
    {
      "code": "GRAPH_RELATED_ID_ASYMMETRY",
      "message": "'MEMINIT-PLAN-006' lists 'MEMINIT-PRD-001' in related_ids but 'MEMINIT-PRD-001' does not list 'MEMINIT-PLAN-006'",
      "source": "MEMINIT-PLAN-006",
      "target": "MEMINIT-PRD-001"
    },
    {
      "code": "GRAPH_RELATED_ID_ASYMMETRY",
      "message": "'MEMINIT-PLAN-006' lists 'MEMINIT-PRD-006' in related_ids but 'MEMINIT-PRD-006' does not list 'MEMINIT-PLAN-006'",
      "source": "MEMINIT-PLAN-006",
      "target": "MEMINIT-PRD-006"
    },
    {
      "code": "GRAPH_RELATED_ID_ASYMMETRY",
      "message": "'MEMINIT-PLAN-006' lists 'MEMINIT-PRD-007' in related_ids but 'MEMINIT-PRD-007' does not list 'MEMINIT-PLAN-006'",
      "source": "MEMINIT-PLAN-006",
      "target": "MEMINIT-PRD-007"
    },
    {
      "code": "GRAPH_RELATED_ID_ASYMMETRY",
      "message": "'MEMINIT-PLAN-007' lists 'MEMINIT-PRD-001' in related_ids but 'MEMINIT-PRD-001' does not list 'MEMINIT-PLAN-007'",
      "source": "MEMINIT-PLAN-007",
      "target": "MEMINIT-PRD-001"
    },
    {
      "code": "GRAPH_RELATED_ID_ASYMMETRY",
      "message": "'MEMINIT-PLAN-008' lists 'MEMINIT-PLAN-003' in related_ids but 'MEMINIT-PLAN-003' does not list 'MEMINIT-PLAN-008'",
      "source": "MEMINIT-PLAN-008",
      "target": "MEMINIT-PLAN-003"
    },
    {
      "code": "GRAPH_RELATED_ID_ASYMMETRY",
      "message": "'MEMINIT-PLAN-008' lists 'MEMINIT-PRD-003' in related_ids but 'MEMINIT-PRD-003' does not list 'MEMINIT-PLAN-008'",
      "source": "MEMINIT-PLAN-008",
      "target": "MEMINIT-PRD-003"
    },
    {
      "code": "GRAPH_RELATED_ID_ASYMMETRY",
      "message": "'MEMINIT-PLAN-008' lists 'MEMINIT-PRD-005' in related_ids but 'MEMINIT-PRD-005' does not list 'MEMINIT-PLAN-008'",
      "source": "MEMINIT-PLAN-008",
      "target": "MEMINIT-PRD-005"
    },
    {
      "code": "GRAPH_RELATED_ID_ASYMMETRY",
      "message": "'MEMINIT-PLAN-008' lists 'MEMINIT-PRD-007' in related_ids but 'MEMINIT-PRD-007' does not list 'MEMINIT-PLAN-008'",
      "source": "MEMINIT-PLAN-008",
      "target": "MEMINIT-PRD-007"
    },
    {
      "code": "GRAPH_RELATED_ID_ASYMMETRY",
      "message": "'MEMINIT-PLAN-008' lists 'MEMINIT-STRAT-001' in related_ids but 'MEMINIT-STRAT-001' does not list 'MEMINIT-PLAN-008'",
      "source": "MEMINIT-PLAN-008",
      "target": "MEMINIT-STRAT-001"
    },
    {
      "code": "GRAPH_RELATED_ID_ASYMMETRY",